{
  "schemaVersion": "1.0.0",
  "id": "q003",
  "title": "火柴棒規律",
  "mode": "deterministic",
  "canvas": {
    "width": 1200,
    "height": 900,
    "background": "#f8fafc"
  },
  "alt": "依序呈現一個、兩個、三個相連正方形及火柴棒數量，推算第五個圖形。",
  "answer": {
    "optionIds": [
      "A",
      "B",
      "C",
      "D"
    ],
    "correctOptionId": "C",
    "unique": true
  },
  "provenance": {
    "provider": "deterministic-renderer",
    "prompt": "",
    "generatedAt": "",
    "notes": "All mathematical content is rendered from visual-spec.json."
  },
  "lockedFacts": [
    {
      "id": "sequence",
      "value": [
        4,
        7,
        10
      ],
      "renderedBy": "overlay"
    },
    {
      "id": "increment",
      "value": 3,
      "renderedBy": "overlay"
    },
    {
      "id": "stage5",
      "value": 16,
      "renderedBy": "overlay"
    }
  ],
  "review": {
    "mathChecked": true,
    "visualChecked": true,
    "ambiguityChecked": true,
    "reviewer": "candidate-demo",
    "notes": "Original public-safe demonstration question."
  },
  "layers": [
    {
      "type": "rect",
      "x": 0,
      "y": 0,
      "width": 1200,
      "height": 900,
      "fill": "#f7fee7"
    },
    {
      "type": "text",
      "x": 600,
      "y": 45,
      "text": "相連正方形的火柴棒規律",
      "fontSize": 49,
      "fill": "#365314",
      "anchor": "center",
      "weight": "bold"
    },
    {
      "type": "text",
      "x": 600,
      "y": 112,
      "text": "第 5 個圖形需要幾根火柴棒？",
      "fontSize": 40,
      "fill": "#4d7c0f",
      "anchor": "center"
    },
    {
      "type": "line",
      "x1": 130,
      "y1": 285,
      "x2": 216,
      "y2": 285,
      "stroke": "#d97706",
      "strokeWidth": 11
    },
    {
      "type": "line",
      "x1": 130,
      "y1": 371,
      "x2": 216,
      "y2": 371,
      "stroke": "#d97706",
      "strokeWidth": 11
    },
    {
      "type": "line",
      "x1": 130,
      "y1": 285,
      "x2": 130,
      "y2": 371,
      "stroke": "#d97706",
      "strokeWidth": 11
    },
    {
      "type": "line",
      "x1": 216,
      "y1": 285,
      "x2": 216,
      "y2": 371,
      "stroke": "#d97706",
      "strokeWidth": 11
    },
    {
      "type": "line",
      "x1": 455,
      "y1": 285,
      "x2": 541,
      "y2": 285,
      "stroke": "#d97706",
      "strokeWidth": 11
    },
    {
      "type": "line",
      "x1": 455,
      "y1": 371,
      "x2": 541,
      "y2": 371,
      "stroke": "#d97706",
      "strokeWidth": 11
    },
    {
      "type": "line",
      "x1": 455,
      "y1": 285,
      "x2": 455,
      "y2": 371,
      "stroke": "#d97706",
      "strokeWidth": 11
    },
    {
      "type": "line",
      "x1": 541,
      "y1": 285,
      "x2": 541,
      "y2": 371,
      "stroke": "#d97706",
      "strokeWidth": 11
    },
    {
      "type": "line",
      "x1": 541,
      "y1": 285,
      "x2": 627,
      "y2": 285,
      "stroke": "#d97706",
      "strokeWidth": 11
    },
    {
      "type": "line",
      "x1": 541,
      "y1": 371,
      "x2": 627,
      "y2": 371,
      "stroke": "#d97706",
      "strokeWidth": 11
    },
    {
      "type": "line",
      "x1": 627,
      "y1": 285,
      "x2": 627,
      "y2": 371,
      "stroke": "#d97706",
      "strokeWidth": 11
    },
    {
      "type": "line",
      "x1": 810,
      "y1": 285,
      "x2": 896,
      "y2": 285,
      "stroke": "#d97706",
      "strokeWidth": 11
    },
    {
      "type": "line",
      "x1": 810,
      "y1": 371,
      "x2": 896,
      "y2": 371,
      "stroke": "#d97706",
      "strokeWidth": 11
    },
    {
      "type": "line",
      "x1": 810,
      "y1": 285,
      "x2": 810,
      "y2": 371,
      "stroke": "#d97706",
      "strokeWidth": 11
    },
    {
      "type": "line",
      "x1": 896,
      "y1": 285,
      "x2": 896,
      "y2": 371,
      "stroke": "#d97706",
      "strokeWidth": 11
    },
    {
      "type": "line",
      "x1": 896,
      "y1": 285,
      "x2": 982,
      "y2": 285,
      "stroke": "#d97706",
      "strokeWidth": 11
    },
    {
      "type": "line",
      "x1": 896,
      "y1": 371,
      "x2": 982,
      "y2": 371,
      "stroke": "#d97706",
      "strokeWidth": 11
    },
    {
      "type": "line",
      "x1": 982,
      "y1": 285,
      "x2": 982,
      "y2": 371,
      "stroke": "#d97706",
      "strokeWidth": 11
    },
    {
      "type": "line",
      "x1": 982,
      "y1": 285,
      "x2": 1068,
      "y2": 285,
      "stroke": "#d97706",
      "strokeWidth": 11
    },
    {
      "type": "line",
      "x1": 982,
      "y1": 371,
      "x2": 1068,
      "y2": 371,
      "stroke": "#d97706",
      "strokeWidth": 11
    },
    {
      "type": "line",
      "x1": 1068,
      "y1": 285,
      "x2": 1068,
      "y2": 371,
      "stroke": "#d97706",
      "strokeWidth": 11
    },
    {
      "type": "text",
      "x": 173,
      "y": 400,
      "text": "第1個：4根",
      "fontSize": 30,
      "fill": "#172033",
      "anchor": "center"
    },
    {
      "type": "text",
      "x": 541,
      "y": 400,
      "text": "第2個：7根",
      "fontSize": 30,
      "fill": "#172033",
      "anchor": "center"
    },
    {
      "type": "text",
      "x": 939,
      "y": 400,
      "text": "第3個：10根",
      "fontSize": 30,
      "fill": "#172033",
      "anchor": "center"
    },
    {
      "type": "text",
      "x": 600,
      "y": 545,
      "text": "每增加一個正方形，只多 3 根火柴棒",
      "fontSize": 36,
      "fill": "#3f6212",
      "anchor": "center",
      "background": "#ffffffdd",
      "padding": 16,
      "backgroundRadius": 14
    },
    {
      "type": "rect",
      "x": 60,
      "y": 740,
      "width": 250,
      "height": 108,
      "fill": "#ffffffee",
      "radius": 18,
      "stroke": "#cbd5e1",
      "strokeWidth": 3
    },
    {
      "type": "circle",
      "x": 100,
      "y": 794,
      "radius": 25,
      "fill": "#6c4df6"
    },
    {
      "type": "text",
      "x": 100,
      "y": 794,
      "text": "A",
      "fontSize": 30,
      "fill": "#ffffff",
      "anchor": "center",
      "valign": "middle",
      "weight": "bold"
    },
    {
      "type": "text",
      "x": 202,
      "y": 794,
      "text": "13",
      "fontSize": 38,
      "fill": "#172033",
      "anchor": "center",
      "valign": "middle",
      "weight": "bold"
    },
    {
      "type": "rect",
      "x": 345,
      "y": 740,
      "width": 250,
      "height": 108,
      "fill": "#ffffffee",
      "radius": 18,
      "stroke": "#cbd5e1",
      "strokeWidth": 3
    },
    {
      "type": "circle",
      "x": 385,
      "y": 794,
      "radius": 25,
      "fill": "#6c4df6"
    },
    {
      "type": "text",
      "x": 385,
      "y": 794,
      "text": "B",
      "fontSize": 30,
      "fill": "#ffffff",
      "anchor": "center",
      "valign": "middle",
      "weight": "bold"
    },
    {
      "type": "text",
      "x": 487,
      "y": 794,
      "text": "15",
      "fontSize": 38,
      "fill": "#172033",
      "anchor": "center",
      "valign": "middle",
      "weight": "bold"
    },
    {
      "type": "rect",
      "x": 630,
      "y": 740,
      "width": 250,
      "height": 108,
      "fill": "#ffffffee",
      "radius": 18,
      "stroke": "#cbd5e1",
      "strokeWidth": 3
    },
    {
      "type": "circle",
      "x": 670,
      "y": 794,
      "radius": 25,
      "fill": "#6c4df6"
    },
    {
      "type": "text",
      "x": 670,
      "y": 794,
      "text": "C",
      "fontSize": 30,
      "fill": "#ffffff",
      "anchor": "center",
      "valign": "middle",
      "weight": "bold"
    },
    {
      "type": "text",
      "x": 772,
      "y": 794,
      "text": "16",
      "fontSize": 38,
      "fill": "#172033",
      "anchor": "center",
      "valign": "middle",
      "weight": "bold"
    },
    {
      "type": "rect",
      "x": 915,
      "y": 740,
      "width": 250,
      "height": 108,
      "fill": "#ffffffee",
      "radius": 18,
      "stroke": "#cbd5e1",
      "strokeWidth": 3
    },
    {
      "type": "circle",
      "x": 955,
      "y": 794,
      "radius": 25,
      "fill": "#6c4df6"
    },
    {
      "type": "text",
      "x": 955,
      "y": 794,
      "text": "D",
      "fontSize": 30,
      "fill": "#ffffff",
      "anchor": "center",
      "valign": "middle",
      "weight": "bold"
    },
    {
      "type": "text",
      "x": 1057,
      "y": 794,
      "text": "20",
      "fontSize": 38,
      "fill": "#172033",
      "anchor": "center",
      "valign": "middle",
      "weight": "bold"
    }
  ]
}
