{
  "schemaVersion": "1.0.0",
  "id": "q002",
  "title": "數線移動",
  "mode": "deterministic",
  "canvas": {
    "width": 1200,
    "height": 900,
    "background": "#f8fafc"
  },
  "alt": "數線上從負三向右移動五格的箭頭，選出終點。",
  "answer": {
    "optionIds": [
      "A",
      "B",
      "C",
      "D"
    ],
    "correctOptionId": "B",
    "unique": true
  },
  "provenance": {
    "provider": "deterministic-renderer",
    "prompt": "",
    "generatedAt": "",
    "notes": "All mathematical content is rendered from visual-spec.json."
  },
  "lockedFacts": [
    {
      "id": "start",
      "value": -3,
      "renderedBy": "overlay"
    },
    {
      "id": "move",
      "value": 5,
      "renderedBy": "overlay"
    },
    {
      "id": "endpoint",
      "value": 2,
      "renderedBy": "overlay"
    }
  ],
  "review": {
    "mathChecked": true,
    "visualChecked": true,
    "ambiguityChecked": true,
    "reviewer": "candidate-demo",
    "notes": "Original public-safe demonstration question."
  },
  "layers": [
    {
      "type": "rect",
      "x": 0,
      "y": 0,
      "width": 1200,
      "height": 900,
      "fill": "#fffaf0"
    },
    {
      "type": "text",
      "x": 600,
      "y": 55,
      "text": "從 -3 出發，向右移動 5 格，會停在哪裡？",
      "fontSize": 47,
      "fill": "#643b14",
      "anchor": "center",
      "weight": "bold"
    },
    {
      "type": "line",
      "x1": 120,
      "y1": 445,
      "x2": 1080,
      "y2": 445,
      "stroke": "#2f4858",
      "strokeWidth": 8,
      "arrowStart": true,
      "arrowEnd": true
    },
    {
      "type": "line",
      "x1": 160,
      "y1": 420,
      "x2": 160,
      "y2": 470,
      "stroke": "#2f4858",
      "strokeWidth": 4
    },
    {
      "type": "text",
      "x": 160,
      "y": 490,
      "text": "-6",
      "fontSize": 28,
      "fill": "#2f4858",
      "anchor": "center",
      "weight": "regular"
    },
    {
      "type": "line",
      "x1": 233,
      "y1": 420,
      "x2": 233,
      "y2": 470,
      "stroke": "#2f4858",
      "strokeWidth": 4
    },
    {
      "type": "text",
      "x": 233,
      "y": 490,
      "text": "-5",
      "fontSize": 28,
      "fill": "#2f4858",
      "anchor": "center",
      "weight": "regular"
    },
    {
      "type": "line",
      "x1": 306,
      "y1": 420,
      "x2": 306,
      "y2": 470,
      "stroke": "#2f4858",
      "strokeWidth": 4
    },
    {
      "type": "text",
      "x": 306,
      "y": 490,
      "text": "-4",
      "fontSize": 28,
      "fill": "#2f4858",
      "anchor": "center",
      "weight": "regular"
    },
    {
      "type": "line",
      "x1": 379,
      "y1": 420,
      "x2": 379,
      "y2": 470,
      "stroke": "#2f4858",
      "strokeWidth": 4
    },
    {
      "type": "text",
      "x": 379,
      "y": 490,
      "text": "-3",
      "fontSize": 28,
      "fill": "#2f4858",
      "anchor": "center",
      "weight": "bold"
    },
    {
      "type": "line",
      "x1": 452,
      "y1": 420,
      "x2": 452,
      "y2": 470,
      "stroke": "#2f4858",
      "strokeWidth": 4
    },
    {
      "type": "text",
      "x": 452,
      "y": 490,
      "text": "-2",
      "fontSize": 28,
      "fill": "#2f4858",
      "anchor": "center",
      "weight": "regular"
    },
    {
      "type": "line",
      "x1": 525,
      "y1": 420,
      "x2": 525,
      "y2": 470,
      "stroke": "#2f4858",
      "strokeWidth": 4
    },
    {
      "type": "text",
      "x": 525,
      "y": 490,
      "text": "-1",
      "fontSize": 28,
      "fill": "#2f4858",
      "anchor": "center",
      "weight": "regular"
    },
    {
      "type": "line",
      "x1": 598,
      "y1": 420,
      "x2": 598,
      "y2": 470,
      "stroke": "#2f4858",
      "strokeWidth": 7
    },
    {
      "type": "text",
      "x": 598,
      "y": 490,
      "text": "0",
      "fontSize": 28,
      "fill": "#2f4858",
      "anchor": "center",
      "weight": "regular"
    },
    {
      "type": "line",
      "x1": 671,
      "y1": 420,
      "x2": 671,
      "y2": 470,
      "stroke": "#2f4858",
      "strokeWidth": 4
    },
    {
      "type": "text",
      "x": 671,
      "y": 490,
      "text": "1",
      "fontSize": 28,
      "fill": "#2f4858",
      "anchor": "center",
      "weight": "regular"
    },
    {
      "type": "line",
      "x1": 744,
      "y1": 420,
      "x2": 744,
      "y2": 470,
      "stroke": "#2f4858",
      "strokeWidth": 4
    },
    {
      "type": "text",
      "x": 744,
      "y": 490,
      "text": "2",
      "fontSize": 28,
      "fill": "#2f4858",
      "anchor": "center",
      "weight": "bold"
    },
    {
      "type": "line",
      "x1": 817,
      "y1": 420,
      "x2": 817,
      "y2": 470,
      "stroke": "#2f4858",
      "strokeWidth": 4
    },
    {
      "type": "text",
      "x": 817,
      "y": 490,
      "text": "3",
      "fontSize": 28,
      "fill": "#2f4858",
      "anchor": "center",
      "weight": "regular"
    },
    {
      "type": "line",
      "x1": 890,
      "y1": 420,
      "x2": 890,
      "y2": 470,
      "stroke": "#2f4858",
      "strokeWidth": 4
    },
    {
      "type": "text",
      "x": 890,
      "y": 490,
      "text": "4",
      "fontSize": 28,
      "fill": "#2f4858",
      "anchor": "center",
      "weight": "regular"
    },
    {
      "type": "line",
      "x1": 963,
      "y1": 420,
      "x2": 963,
      "y2": 470,
      "stroke": "#2f4858",
      "strokeWidth": 4
    },
    {
      "type": "text",
      "x": 963,
      "y": 490,
      "text": "5",
      "fontSize": 28,
      "fill": "#2f4858",
      "anchor": "center",
      "weight": "regular"
    },
    {
      "type": "line",
      "x1": 1036,
      "y1": 420,
      "x2": 1036,
      "y2": 470,
      "stroke": "#2f4858",
      "strokeWidth": 4
    },
    {
      "type": "text",
      "x": 1036,
      "y": 490,
      "text": "6",
      "fontSize": 28,
      "fill": "#2f4858",
      "anchor": "center",
      "weight": "regular"
    },
    {
      "type": "circle",
      "x": 379,
      "y": 445,
      "radius": 16,
      "fill": "#e63946"
    },
    {
      "type": "circle",
      "x": 744,
      "y": 445,
      "radius": 16,
      "fill": "#2a9d8f"
    },
    {
      "type": "line",
      "x1": 379,
      "y1": 325,
      "x2": 744,
      "y2": 325,
      "stroke": "#e76f51",
      "strokeWidth": 10,
      "arrowEnd": true
    },
    {
      "type": "text",
      "x": 561.5,
      "y": 255,
      "text": "向右 5 格",
      "fontSize": 38,
      "fill": "#e76f51",
      "anchor": "center",
      "weight": "bold",
      "background": "#ffffffdd",
      "padding": 12
    },
    {
      "type": "rect",
      "x": 60,
      "y": 740,
      "width": 250,
      "height": 108,
      "fill": "#ffffffee",
      "radius": 18,
      "stroke": "#cbd5e1",
      "strokeWidth": 3
    },
    {
      "type": "circle",
      "x": 100,
      "y": 794,
      "radius": 25,
      "fill": "#6c4df6"
    },
    {
      "type": "text",
      "x": 100,
      "y": 794,
      "text": "A",
      "fontSize": 30,
      "fill": "#ffffff",
      "anchor": "center",
      "valign": "middle",
      "weight": "bold"
    },
    {
      "type": "text",
      "x": 202,
      "y": 794,
      "text": "-8",
      "fontSize": 38,
      "fill": "#172033",
      "anchor": "center",
      "valign": "middle",
      "weight": "bold"
    },
    {
      "type": "rect",
      "x": 345,
      "y": 740,
      "width": 250,
      "height": 108,
      "fill": "#ffffffee",
      "radius": 18,
      "stroke": "#cbd5e1",
      "strokeWidth": 3
    },
    {
      "type": "circle",
      "x": 385,
      "y": 794,
      "radius": 25,
      "fill": "#6c4df6"
    },
    {
      "type": "text",
      "x": 385,
      "y": 794,
      "text": "B",
      "fontSize": 30,
      "fill": "#ffffff",
      "anchor": "center",
      "valign": "middle",
      "weight": "bold"
    },
    {
      "type": "text",
      "x": 487,
      "y": 794,
      "text": "2",
      "fontSize": 38,
      "fill": "#172033",
      "anchor": "center",
      "valign": "middle",
      "weight": "bold"
    },
    {
      "type": "rect",
      "x": 630,
      "y": 740,
      "width": 250,
      "height": 108,
      "fill": "#ffffffee",
      "radius": 18,
      "stroke": "#cbd5e1",
      "strokeWidth": 3
    },
    {
      "type": "circle",
      "x": 670,
      "y": 794,
      "radius": 25,
      "fill": "#6c4df6"
    },
    {
      "type": "text",
      "x": 670,
      "y": 794,
      "text": "C",
      "fontSize": 30,
      "fill": "#ffffff",
      "anchor": "center",
      "valign": "middle",
      "weight": "bold"
    },
    {
      "type": "text",
      "x": 772,
      "y": 794,
      "text": "-2",
      "fontSize": 38,
      "fill": "#172033",
      "anchor": "center",
      "valign": "middle",
      "weight": "bold"
    },
    {
      "type": "rect",
      "x": 915,
      "y": 740,
      "width": 250,
      "height": 108,
      "fill": "#ffffffee",
      "radius": 18,
      "stroke": "#cbd5e1",
      "strokeWidth": 3
    },
    {
      "type": "circle",
      "x": 955,
      "y": 794,
      "radius": 25,
      "fill": "#6c4df6"
    },
    {
      "type": "text",
      "x": 955,
      "y": 794,
      "text": "D",
      "fontSize": 30,
      "fill": "#ffffff",
      "anchor": "center",
      "valign": "middle",
      "weight": "bold"
    },
    {
      "type": "text",
      "x": 1057,
      "y": 794,
      "text": "8",
      "fontSize": 38,
      "fill": "#172033",
      "anchor": "center",
      "valign": "middle",
      "weight": "bold"
    }
  ]
}
