{
  "schemaVersion": "1.0.0",
  "id": "q005",
  "title": "密室三線索",
  "mode": "ai-composite",
  "canvas": {
    "width": 1200,
    "height": 900,
    "background": "#f8fafc"
  },
  "alt": "神祕圖書室背景上有三張依序排列的算式線索卡，組合答案成三位數密碼。",
  "answer": {
    "optionIds": [
      "A",
      "B",
      "C",
      "D"
    ],
    "correctOptionId": "A",
    "unique": true
  },
  "provenance": {
    "provider": "OpenAI built-in image generation",
    "prompt": "Use case: illustration-story\nAsset type: background for a junior-high Wayground escape-room math puzzle\nPrimary request: Create a friendly mystery-library room designed for a classroom puzzle. Include bookshelves, a wooden desk, a closed door, a decorative wall clock without visible numbers, and a central empty corkboard or wall panel with generous clear space where exact clue cards and a code lock will later be overlaid.\nStyle/medium: polished flat 2.5D educational illustration, intriguing but not scary\nComposition/framing: landscape 4:3, straight-on room view, central board clearly visible, balanced negative space\nLighting/mood: warm evening lamplight, curious and inviting\nColor palette: navy, burgundy, warm wood, gold accents\nConstraints: atmosphere only; no readable text, no numbers, no equations, no codes, no logos, no watermark; do not insert hidden clues; every mathematical clue will be added later by code\nAvoid: horror imagery, clutter that invites accidental counting, distorted perspective, illegible signs, embedded answer choices",
    "generatedAt": "2026-07-24",
    "notes": "AI only generated the narrative background. All math facts are deterministic overlays."
  },
  "lockedFacts": [
    {
      "id": "clue1",
      "value": 5,
      "renderedBy": "overlay"
    },
    {
      "id": "clue2",
      "value": 8,
      "renderedBy": "overlay"
    },
    {
      "id": "clue3",
      "value": 3,
      "renderedBy": "overlay"
    },
    {
      "id": "code",
      "value": 583,
      "renderedBy": "overlay"
    }
  ],
  "review": {
    "mathChecked": true,
    "visualChecked": true,
    "ambiguityChecked": true,
    "reviewer": "candidate-demo",
    "notes": "Original public-safe demonstration question."
  },
  "layers": [
    {
      "type": "image",
      "path": "background-ai.png",
      "x": 0,
      "y": 0,
      "width": 1200,
      "height": 900,
      "fit": "cover"
    },
    {
      "type": "rect",
      "x": 35,
      "y": 25,
      "width": 1130,
      "height": 100,
      "fill": "#0f172add",
      "radius": 20
    },
    {
      "type": "text",
      "x": 600,
      "y": 75,
      "text": "解開三張線索卡，找出門鎖密碼",
      "fontSize": 46,
      "fill": "#ffffff",
      "anchor": "center",
      "valign": "middle",
      "weight": "bold"
    },
    {
      "type": "rect",
      "x": 390,
      "y": 190,
      "width": 190,
      "height": 220,
      "fill": "#fffaf0ee",
      "radius": 18,
      "stroke": "#8b5e34",
      "strokeWidth": 4
    },
    {
      "type": "text",
      "x": 485,
      "y": 232,
      "text": "線索一",
      "fontSize": 28,
      "fill": "#7c2d12",
      "anchor": "center",
      "weight": "bold"
    },
    {
      "type": "text",
      "x": 485,
      "y": 312,
      "text": "-4 + 9",
      "fontSize": 42,
      "fill": "#172033",
      "anchor": "center",
      "weight": "bold"
    },
    {
      "type": "text",
      "x": 485,
      "y": 368,
      "text": "答案是一位密碼",
      "fontSize": 22,
      "fill": "#57534e",
      "anchor": "center"
    },
    {
      "type": "rect",
      "x": 620,
      "y": 190,
      "width": 190,
      "height": 220,
      "fill": "#fffaf0ee",
      "radius": 18,
      "stroke": "#8b5e34",
      "strokeWidth": 4
    },
    {
      "type": "text",
      "x": 715,
      "y": 232,
      "text": "線索二",
      "fontSize": 28,
      "fill": "#7c2d12",
      "anchor": "center",
      "weight": "bold"
    },
    {
      "type": "text",
      "x": 715,
      "y": 312,
      "text": "2³",
      "fontSize": 42,
      "fill": "#172033",
      "anchor": "center",
      "weight": "bold"
    },
    {
      "type": "text",
      "x": 715,
      "y": 368,
      "text": "答案是一位密碼",
      "fontSize": 22,
      "fill": "#57534e",
      "anchor": "center"
    },
    {
      "type": "rect",
      "x": 850,
      "y": 190,
      "width": 190,
      "height": 220,
      "fill": "#fffaf0ee",
      "radius": 18,
      "stroke": "#8b5e34",
      "strokeWidth": 4
    },
    {
      "type": "text",
      "x": 945,
      "y": 232,
      "text": "線索三",
      "fontSize": 28,
      "fill": "#7c2d12",
      "anchor": "center",
      "weight": "bold"
    },
    {
      "type": "text",
      "x": 945,
      "y": 312,
      "text": "18 ÷ 6",
      "fontSize": 42,
      "fill": "#172033",
      "anchor": "center",
      "weight": "bold"
    },
    {
      "type": "text",
      "x": 945,
      "y": 368,
      "text": "答案是一位密碼",
      "fontSize": 22,
      "fill": "#57534e",
      "anchor": "center"
    },
    {
      "type": "text",
      "x": 660,
      "y": 460,
      "text": "依照「線索一、二、三」的順序輸入",
      "fontSize": 34,
      "fill": "#ffffff",
      "anchor": "center",
      "weight": "bold",
      "background": "#0f172acc",
      "padding": 15,
      "backgroundRadius": 15
    },
    {
      "type": "rect",
      "x": 60,
      "y": 740,
      "width": 250,
      "height": 108,
      "fill": "#ffffffee",
      "radius": 18,
      "stroke": "#cbd5e1",
      "strokeWidth": 3
    },
    {
      "type": "circle",
      "x": 100,
      "y": 794,
      "radius": 25,
      "fill": "#6c4df6"
    },
    {
      "type": "text",
      "x": 100,
      "y": 794,
      "text": "A",
      "fontSize": 30,
      "fill": "#ffffff",
      "anchor": "center",
      "valign": "middle",
      "weight": "bold"
    },
    {
      "type": "text",
      "x": 202,
      "y": 794,
      "text": "583",
      "fontSize": 38,
      "fill": "#172033",
      "anchor": "center",
      "valign": "middle",
      "weight": "bold"
    },
    {
      "type": "rect",
      "x": 345,
      "y": 740,
      "width": 250,
      "height": 108,
      "fill": "#ffffffee",
      "radius": 18,
      "stroke": "#cbd5e1",
      "strokeWidth": 3
    },
    {
      "type": "circle",
      "x": 385,
      "y": 794,
      "radius": 25,
      "fill": "#6c4df6"
    },
    {
      "type": "text",
      "x": 385,
      "y": 794,
      "text": "B",
      "fontSize": 30,
      "fill": "#ffffff",
      "anchor": "center",
      "valign": "middle",
      "weight": "bold"
    },
    {
      "type": "text",
      "x": 487,
      "y": 794,
      "text": "538",
      "fontSize": 38,
      "fill": "#172033",
      "anchor": "center",
      "valign": "middle",
      "weight": "bold"
    },
    {
      "type": "rect",
      "x": 630,
      "y": 740,
      "width": 250,
      "height": 108,
      "fill": "#ffffffee",
      "radius": 18,
      "stroke": "#cbd5e1",
      "strokeWidth": 3
    },
    {
      "type": "circle",
      "x": 670,
      "y": 794,
      "radius": 25,
      "fill": "#6c4df6"
    },
    {
      "type": "text",
      "x": 670,
      "y": 794,
      "text": "C",
      "fontSize": 30,
      "fill": "#ffffff",
      "anchor": "center",
      "valign": "middle",
      "weight": "bold"
    },
    {
      "type": "text",
      "x": 772,
      "y": 794,
      "text": "853",
      "fontSize": 38,
      "fill": "#172033",
      "anchor": "center",
      "valign": "middle",
      "weight": "bold"
    },
    {
      "type": "rect",
      "x": 915,
      "y": 740,
      "width": 250,
      "height": 108,
      "fill": "#ffffffee",
      "radius": 18,
      "stroke": "#cbd5e1",
      "strokeWidth": 3
    },
    {
      "type": "circle",
      "x": 955,
      "y": 794,
      "radius": 25,
      "fill": "#6c4df6"
    },
    {
      "type": "text",
      "x": 955,
      "y": 794,
      "text": "D",
      "fontSize": 30,
      "fill": "#ffffff",
      "anchor": "center",
      "valign": "middle",
      "weight": "bold"
    },
    {
      "type": "text",
      "x": 1057,
      "y": 794,
      "text": "835",
      "fontSize": 38,
      "fill": "#172033",
      "anchor": "center",
      "valign": "middle",
      "weight": "bold"
    }
  ]
}
