{
  "schemaVersion": "1.0.0",
  "id": "q001",
  "title": "天平方程式",
  "mode": "deterministic",
  "canvas": {
    "width": 1200,
    "height": 900,
    "background": "#f8fafc"
  },
  "alt": "平衡天平左盤有三個 x 方塊與重量六，右盤重量二十四，選出 x 的值。",
  "answer": {
    "optionIds": [
      "A",
      "B",
      "C",
      "D"
    ],
    "correctOptionId": "A",
    "unique": true
  },
  "provenance": {
    "provider": "deterministic-renderer",
    "prompt": "",
    "generatedAt": "",
    "notes": "All mathematical content is rendered from visual-spec.json."
  },
  "lockedFacts": [
    {
      "id": "equation",
      "value": "3x+6=24",
      "renderedBy": "overlay"
    },
    {
      "id": "solution",
      "value": 6,
      "renderedBy": "overlay"
    }
  ],
  "review": {
    "mathChecked": true,
    "visualChecked": true,
    "ambiguityChecked": true,
    "reviewer": "candidate-demo",
    "notes": "Original public-safe demonstration question."
  },
  "layers": [
    {
      "type": "rect",
      "x": 0,
      "y": 0,
      "width": 1200,
      "height": 900,
      "fill": "#edf6ff"
    },
    {
      "type": "text",
      "x": 600,
      "y": 52,
      "text": "天平保持平衡，求 x 的值",
      "fontSize": 50,
      "fill": "#173b63",
      "anchor": "center",
      "weight": "bold"
    },
    {
      "type": "line",
      "x1": 600,
      "y1": 240,
      "x2": 600,
      "y2": 620,
      "stroke": "#355070",
      "strokeWidth": 16
    },
    {
      "type": "rect",
      "x": 520,
      "y": 610,
      "width": 160,
      "height": 35,
      "fill": "#355070",
      "radius": 12
    },
    {
      "type": "line",
      "x1": 255,
      "y1": 345,
      "x2": 945,
      "y2": 345,
      "stroke": "#355070",
      "strokeWidth": 14
    },
    {
      "type": "circle",
      "x": 600,
      "y": 345,
      "radius": 26,
      "fill": "#f6bd60",
      "stroke": "#9c6a16",
      "strokeWidth": 4
    },
    {
      "type": "line",
      "x1": 300,
      "y1": 345,
      "x2": 235,
      "y2": 535,
      "stroke": "#7b8794",
      "strokeWidth": 5
    },
    {
      "type": "line",
      "x1": 300,
      "y1": 345,
      "x2": 365,
      "y2": 535,
      "stroke": "#7b8794",
      "strokeWidth": 5
    },
    {
      "type": "line",
      "x1": 900,
      "y1": 345,
      "x2": 835,
      "y2": 535,
      "stroke": "#7b8794",
      "strokeWidth": 5
    },
    {
      "type": "line",
      "x1": 900,
      "y1": 345,
      "x2": 965,
      "y2": 535,
      "stroke": "#7b8794",
      "strokeWidth": 5
    },
    {
      "type": "line",
      "x1": 210,
      "y1": 535,
      "x2": 390,
      "y2": 535,
      "stroke": "#355070",
      "strokeWidth": 9
    },
    {
      "type": "line",
      "x1": 810,
      "y1": 535,
      "x2": 990,
      "y2": 535,
      "stroke": "#355070",
      "strokeWidth": 9
    },
    {
      "type": "rect",
      "x": 230,
      "y": 455,
      "width": 48,
      "height": 64,
      "fill": "#5aa9e6",
      "radius": 8
    },
    {
      "type": "text",
      "x": 254,
      "y": 487,
      "text": "x",
      "fontSize": 30,
      "fill": "#ffffff",
      "anchor": "center",
      "valign": "middle",
      "weight": "bold"
    },
    {
      "type": "rect",
      "x": 285,
      "y": 455,
      "width": 48,
      "height": 64,
      "fill": "#5aa9e6",
      "radius": 8
    },
    {
      "type": "text",
      "x": 309,
      "y": 487,
      "text": "x",
      "fontSize": 30,
      "fill": "#ffffff",
      "anchor": "center",
      "valign": "middle",
      "weight": "bold"
    },
    {
      "type": "rect",
      "x": 340,
      "y": 455,
      "width": 48,
      "height": 64,
      "fill": "#5aa9e6",
      "radius": 8
    },
    {
      "type": "text",
      "x": 364,
      "y": 487,
      "text": "x",
      "fontSize": 30,
      "fill": "#ffffff",
      "anchor": "center",
      "valign": "middle",
      "weight": "bold"
    },
    {
      "type": "rect",
      "x": 270,
      "y": 395,
      "width": 62,
      "height": 50,
      "fill": "#f6bd60",
      "radius": 10
    },
    {
      "type": "text",
      "x": 301,
      "y": 420,
      "text": "6",
      "fontSize": 30,
      "fill": "#172033",
      "anchor": "center",
      "valign": "middle",
      "weight": "bold"
    },
    {
      "type": "rect",
      "x": 858,
      "y": 435,
      "width": 86,
      "height": 84,
      "fill": "#f28482",
      "radius": 12
    },
    {
      "type": "text",
      "x": 901,
      "y": 477,
      "text": "24",
      "fontSize": 34,
      "fill": "#ffffff",
      "anchor": "center",
      "valign": "middle",
      "weight": "bold"
    },
    {
      "type": "text",
      "x": 600,
      "y": 675,
      "text": "圖中代表 3x + 6 = 24",
      "fontSize": 36,
      "fill": "#334155",
      "anchor": "center"
    },
    {
      "type": "rect",
      "x": 60,
      "y": 740,
      "width": 250,
      "height": 108,
      "fill": "#ffffffee",
      "radius": 18,
      "stroke": "#cbd5e1",
      "strokeWidth": 3
    },
    {
      "type": "circle",
      "x": 100,
      "y": 794,
      "radius": 25,
      "fill": "#6c4df6"
    },
    {
      "type": "text",
      "x": 100,
      "y": 794,
      "text": "A",
      "fontSize": 30,
      "fill": "#ffffff",
      "anchor": "center",
      "valign": "middle",
      "weight": "bold"
    },
    {
      "type": "text",
      "x": 202,
      "y": 794,
      "text": "6",
      "fontSize": 38,
      "fill": "#172033",
      "anchor": "center",
      "valign": "middle",
      "weight": "bold"
    },
    {
      "type": "rect",
      "x": 345,
      "y": 740,
      "width": 250,
      "height": 108,
      "fill": "#ffffffee",
      "radius": 18,
      "stroke": "#cbd5e1",
      "strokeWidth": 3
    },
    {
      "type": "circle",
      "x": 385,
      "y": 794,
      "radius": 25,
      "fill": "#6c4df6"
    },
    {
      "type": "text",
      "x": 385,
      "y": 794,
      "text": "B",
      "fontSize": 30,
      "fill": "#ffffff",
      "anchor": "center",
      "valign": "middle",
      "weight": "bold"
    },
    {
      "type": "text",
      "x": 487,
      "y": 794,
      "text": "8",
      "fontSize": 38,
      "fill": "#172033",
      "anchor": "center",
      "valign": "middle",
      "weight": "bold"
    },
    {
      "type": "rect",
      "x": 630,
      "y": 740,
      "width": 250,
      "height": 108,
      "fill": "#ffffffee",
      "radius": 18,
      "stroke": "#cbd5e1",
      "strokeWidth": 3
    },
    {
      "type": "circle",
      "x": 670,
      "y": 794,
      "radius": 25,
      "fill": "#6c4df6"
    },
    {
      "type": "text",
      "x": 670,
      "y": 794,
      "text": "C",
      "fontSize": 30,
      "fill": "#ffffff",
      "anchor": "center",
      "valign": "middle",
      "weight": "bold"
    },
    {
      "type": "text",
      "x": 772,
      "y": 794,
      "text": "10",
      "fontSize": 38,
      "fill": "#172033",
      "anchor": "center",
      "valign": "middle",
      "weight": "bold"
    },
    {
      "type": "rect",
      "x": 915,
      "y": 740,
      "width": 250,
      "height": 108,
      "fill": "#ffffffee",
      "radius": 18,
      "stroke": "#cbd5e1",
      "strokeWidth": 3
    },
    {
      "type": "circle",
      "x": 955,
      "y": 794,
      "radius": 25,
      "fill": "#6c4df6"
    },
    {
      "type": "text",
      "x": 955,
      "y": 794,
      "text": "D",
      "fontSize": 30,
      "fill": "#ffffff",
      "anchor": "center",
      "valign": "middle",
      "weight": "bold"
    },
    {
      "type": "text",
      "x": 1057,
      "y": 794,
      "text": "12",
      "fontSize": 38,
      "fill": "#172033",
      "anchor": "center",
      "valign": "middle",
      "weight": "bold"
    }
  ]
}
